{
  "name": "Kaggle Predicting F1 Pit Stops",
  "source_url": "https://www.kaggle.com/competitions/playground-series-s6e5",
  "eligibility": "开放参赛",
  "deadline_or_window": "active on 2026-05-14, about 18 days to go",
  "fit_8gb": "A 本地可做",
  "recommendation": "active",
  "risks": [
    "提交前需要复核完整官方规则、资格和交付物。"
  ],
  "next_48h_plan": [
    "整理官方规则证据，确认资格、截止时间、交付字段。",
    "定义最小数据 schema，并准备 3 个真实比赛样例。",
    "实现 Markdown 输入到结构化比赛卡片的本地闭环。",
    "记录人工复核点和失败样例，为 PoU 证据做准备。"
  ],
  "evidence": [
    "L3: Source: https://www.kaggle.com/competitions/playground-series-s6e5",
    "L5: Window: active on 2026-05-14, about 18 days to go.",
    "L7: Open competition on Kaggle Playground.",
    "L11: Local constraint: Windows, 8GB GPU. CPU training with LightGBM, XGBoost, CatBoost, or sklearn is feasible. Kaggle Notebook can be used for submission workflow.",
    "L13: Decision note: Use as second active line for baseline and submission practice."
  ]
}
